[
  {
    "id": "onyxian-drake",
    "name": "Onyxian Drake",
    "expansion": "Classic",
    "category": "Flying",
    "faction": "Neutral",
    "sourceType": "Drop",
    "sourceDetail": "Onyxia (10/25 player)",
    "zone": "Onyxia's Lair",
    "wowheadId": 49636,
    "requiresRiding": "Artisan Riding",
    "tags": ["rare", "raid", "drop"],
    "dataVersion": 1,
    "lastUpdatedUtc": "2025-09-07T00:00:00Z"
  },
  {
    "id": "black-war-steed",
    "name": "Black War Steed",
    "expansion": "Classic",
    "category": "Ground",
    "faction": "Alliance",
    "sourceType": "Vendor",
    "sourceDetail": "Honor Points",
    "zone": "Stormwind City",
    "cost": "30,000 Honor Points",
    "tags": ["pvp", "honor"],
    "dataVersion": 1,
    "lastUpdatedUtc": "2025-09-07T00:00:00Z"
  },
  {
    "id": "red-dragonhawk",
    "name": "Red Dragonhawk",
    "expansion": "The Burning Crusade",
    "category": "Flying",
    "faction": "Horde",
    "sourceType": "Vendor",
    "sourceDetail": "Dragonhawk Quartermaster",
    "zone": "Eversong Woods",
    "cost": "10g",
    "requiresRiding": "Expert Riding",
    "tags": ["faction", "vendor"],
    "dataVersion": 1,
    "lastUpdatedUtc": "2025-09-07T00:00:00Z"
  },
  {
    "id": "azure-drake",
    "name": "Azure Drake",
    "expansion": "Wrath of the Lich King",
    "category": "Flying",
    "faction": "Neutral",
    "sourceType": "Drop",
    "sourceDetail": "Malygos (10 player)",
    "zone": "The Eye of Eternity",
    "wowheadId": 59996,
    "requiresRiding": "Artisan Riding",
    "tags": ["rare", "raid", "drop"],
    "dataVersion": 1,
    "lastUpdatedUtc": "2025-09-07T00:00:00Z"
  },
  {
    "id": "drake-of-the-south-wind",
    "name": "Drake of the South Wind",
    "expansion": "Cataclysm", 
    "category": "Flying",
    "faction": "Neutral",
    "sourceType": "Drop",
    "sourceDetail": "Al'Akir",
    "zone": "Throne of the Four Winds",
    "wowheadId": 63041,
    "requiresRiding": "Artisan Riding",
    "tags": ["rare", "raid", "drop"],
    "dataVersion": 1,
    "lastUpdatedUtc": "2025-09-07T00:00:00Z"
  },
  {
    "id": "heavenly-onyx-cloud-serpent",
    "name": "Heavenly Onyx Cloud Serpent",
    "expansion": "Mists of Pandaria",
    "category": "Flying",
    "faction": "Neutral",
    "sourceType": "Achievement",
    "sourceDetail": "Leading the Cavalry",
    "reputationReq": "Exalted with Shado-Pan",
    "tags": ["achievement", "reputation", "cloud-serpent"],
    "notes": "Requires obtaining 150 mounts",
    "dataVersion": 1,
    "lastUpdatedUtc": "2025-09-07T00:00:00Z"
  }
]